Post ID,Answer ID,Answer,Vote Score,Date,User ID
1,1,"
If your devices need Internet access, use a three router Y-configuration to separate your 'ordinary' (home/work) network from the one containing your IOT devices.
There are plenty of resources about that on the Internet.
This article goes in-depth describing the disadvantages of simpler configurations, leading up to the Y concept. The author even has a walkthrough showing how he set this up for himself.
Note: Many modern router devices let you mimic this configuration with one box only, but talking about three physical ones makes you understand it better. You may even have some old routers laying around that you now have a purpose for.
",1,2018-02-05 20:59:37Z,0
1,2,"
You start by not giving them access to the Internet.  If your Intranet of Things devices have no direct contact with the outside world (eg. your IoT sprinkler controller is firewalled off from the Internet and needs to go through a proxy when requesting a weather forecast), it becomes much harder for an attacker to do anything.  If there's no connection whatsoever, any attacker needs to be physically present.
",2,2018-02-02 22:42:21Z,3
1,3,"
You didn't mention the first rule of IoT security. Change the admin password. If possible make it complex. I have witnessed hundreds, if not thousands, of penetration attempts and most of them are attempting to compromise some form of administration account with guessable passwords. 
Another thing that you can do is register it with a directory. You may have AD available to you but there are also dozens of online cloud versions available too.
If you are going to have multiple devices this can simplify any administrative
activities as well.
",1,2018-02-05 17:36:33Z,4
1,4,"
IoT is a loaded term.  I'm going to assume the topic is about ""How to keep self-configured IoT devices secure"" and disregard cloud-based IoT devices.
The best way to learn about securing IoT devices is to learn how generic security works.  IoT devices are by definition, internet connected devices.  They are no different than computers, servers, network printers, routers, switches, etc.  They face all the same problems that those devices face when it comes to security.
You can find a ton of information on how to secure network infrastructure online.  There are many other resources as well, such as academic classes.
I personally, run a firewall on my router that segments my network and white-list locations I access it from.
To disregard my disregard, cloud-IoT devices are at the mercy of their cloud services.
",1,2018-02-05 20:10:00Z,2
1,5,"

Lastly as an importart part of the threat model is physical security, because if I put a sensor outside with a solar panel to power it, how do I stop mischievous kids or crooks from destroying or stealing the technology?

You, essentially, have to build a better mouse trap. Consider your physical security situation - is the street side of your house safe, but kids out of view of the streets will wreck things? Perhaps the opposite is true - position the sensors within view of the street (or vice versa). Next, consider replace-ability - is this a cheap sensor or a $150 weather station type deal? Consider pairing down the features of outdoor sensors to lower the cost of replacement. If it takes you five minutes and five dollars to replace the sensor, who cares if it's broken or stolen every three months. Thirdly, consider hardening - is your sensor on the top of a 30 ft roof? Is it resistant to a baseball or rock? Do you need to walk up to it and wail on it with a golf club for a few minutes to break it? Can you make it that resistant? 
All security is about making compromise ""not worth it"" for the attacker. It's hard to overcome the ""worth it"" factor for teenagers - the destruction itself is the reward, and making a harder target makes the destruction more fun. You'll have to think critically about what you need to do to make the sensors unlikely to be damaged, or make them easier to replace when damage occurs.
",1,2018-02-05 20:34:31Z,5
2,1,"
Be very, very careful. It's not KRACK that is the problem, it is a lax attitude to security and privacy in general. So called ""smart"" consumer products can often be hijacked, accessed from the internet, or monitored. As a customer, it is hard to know if any specific product is safe or not.
The Norwegian Consumer Council has been on the case for a while, and produced a few horror stories. From a report, aptly titled #ToyFail, on three ""smart"" dolls:

When scrutinizing the terms of use and privacy policies of the connected toys, the NCC found a general disconcerting lack of regard to basic consumer and privacy rights. [...]
Furthermore, the terms are generally vague about data retention, and reserve the right to terminate the service at any time without sufficient reason. Additionally, two of the toys transfer personal information to a commercial third party, who reserves the right to use this information for practically any purpose, unrelated to the functionality of toys themselves. 


[I]t was discovered that two of the toys have practically no embedded
  security. This means that anyone may gain access to the microphone and speakers
  within the toys, without requiring physical access to the products. This is a
  serious security flaw, which should never have been present in the toys in the
  first place.

And from an other of their reports, again aptly named #WatchOut, on ""smart"" watches for kids:

[T]wo of the devices have flaws which could allow a potential attacker to take control of the apps, thus gaining access to children’s real-time and historical location and personal details, as well as even enabling them to contact the children directly, all without the parents’ knowledge.
Additionally, several of the devices transmit personal data to servers located in North America and East Asia, in some cases without any encryption in place. One of the watches also functions as a listening device, allowing the parent or a stranger with some technical knowledge to audio monitor the surroundings of the child without any clear indication on the physical watch that this is taking place.

And the FBI agrees:

Smart toys and entertainment devices for children are increasingly incorporating technologies that learn and tailor their behaviours based on user interactions. These features could put the privacy and safety of children at risk due to the large amount of personal information that may be unwittingly disclosed.

So unless you have a real need (other than ""this is cool"") for these kinds of products, I would say that your best approach is to simply stay away from them.
",92,2017-10-31 15:13:39Z,9
2,2,"
It really depends on your threat model.  I wouldn't be particularly worried about a particular sexual predator in your local area having the technical skills necessary to utilize Krack to inject voice into the toy. Unless it uses the vulnerable Linux driver, the key clearing won't work and the partial nature of the compromise for a general reset would make voice injection nearly impossible.  
Similarly, as a client device, it doesn't offer a whole lot of security risk other than possibly as a listening device, depending on if it is always on or activated by pushing a button.  Krack wouldn't make it usable as an entry point in to your network directly, so I don't see it as a particularly riskier device than any other IOT device.
As always in security, it comes down to your risk aversion though.  Personally, if I thought it would be valuable to my child (who is also 3) I don't think I would consider the local security implications as a reason not to get it for my home environment.  I'd be more concerned about the controls and security on the web side.  
My main concern for IOT devices isn't the local compromise so much as the web connected remote compromise.  The chances of a sufficiently skilled and motivated malicious individual in your direct proximity is pretty low.  The chances of a motivated and malicious user on the Internet trying to remotely access the IOT device is significantly higher and it's important to understand what holes the devices punch in your network protections.
Also, as Michael was kind enough to point out, the interests of such a broad hacker are much less likely to be concerned with your privacy and much more likely to either be interested in attacks on your other computers or on the computational capabilities of the device as an attack bot.
",15,2017-10-31 15:04:35Z,11
2,3,"
Welcome to the Internet of Things(IoT). This is a... thing. Therefore, it can be assimilated

Mirai is a type of malware that automatically finds Internet of Things devices to infect and conscripts them into a botnet—a group of computing devices that can be centrally controlled.

And

One reason Mirai is so difficult to contain is that it lurks on devices, and generally doesn't noticeably affect their performance. There's no reason the average user would ever think that their webcam—or more likely, a small business's—is potentially part of an active botnet. And even if it were, there's not much they could do about it, having no direct way to interface with the infected product.

The problem is that security is seldom a consideration when making toys like this. The technology to make all this work is fairly simple, but the companies aren't paid to think about this. It's a child's toy. It's meant to be cheap and easy. And you get what you pay for. 
Earlier this year, it was found that a similar child's toy had no security at all (emphasis mine)

A maker of Internet-connected stuffed animal toys has exposed more than 2 million voice recordings of children and parents, as well as e-mail addresses and password data for more than 800,000 accounts.
The account data was left in a publicly available database that wasn't protected by a password or placed behind a firewall, according to a blog post published Monday by Troy Hunt, maintainter of the Have I Been Pwned?, breach-notification website. He said searches using the Shodan computer search engine and other evidence indicated that, since December 25 and January 8, the customer data was accessed multiple times by multiple parties, including criminals who ultimately held the data for ransom. The recordings were available on an Amazon-hosted service that required no authorization to access.

I'm going to be honest. These things are scary powerful in what they can do. Even if it doesn't expose your messaging, it could still be used for something malicious like a DDOS attack. If I were you, I'd pass on anything like this unless there's something explicit about security.
",12,2017-10-31 18:09:50Z,13
2,4,"
This is pretty much the same kind of toy as CloudPets. Those were toys that allowed talking with the children (toy) by using a mobile app. The security was terrible. It turned out that both the user details and the pet recordings were available on databases with no password. And the company didn't even answer to the mails alerting them of the vulnerabilities.
You can view about this terrifying story on Troy Hunt blog: https://www.troyhunt.com/data-from-connected-cloudpets-teddy-bears-leaked-and-ransomed-exposing-kids-voice-messages/
Now, Talkies may actually have made the right choices (it's hard to do so many things wrong as CloudPets did!), but this showcases the level of security of this sector.
So no, I wouldn't trust this toy with my kids data. Not to mention how the toy itself could be compromised (eg. like Hello Barbie).
In fact, Germany went so far to ban the internet connected Cayla dolls over fears they could be exploited to target children: https://www.telegraph.co.uk/news/2017/02/17/germany-bans-internet-connected-dolls-fears-hackers-could-target/
",6,2017-11-01 17:29:50Z,14
2,5,"
Internet-enabled anything poses a risk.  As a rule, security is an expense and consumers as a whole really don't consider product security when making purchasing decisions.  For example, there was a thread on Reddit recently about a couple who got divorced and she didn't change the password on the Nest thermostat.  So while she was out, he would crank up the air conditioning or heat and cause massive utility bills.  We also know of baby monitors that have been used to listen in on neighbors without their consent.  I've attended IT security demos of internet-connected light switches, showing how easy it was to attack them.
krack is important, definitely, but when compared to a non-existent security posture is irrelevant.  Quite simply, if someone is concerned about security, I'd suggest not purchasing networkable anything unless they can identify a need for it to have a network connection and they have the skills to properly secure both it and their network.
WRT your trusted circle of phones: how often would you plan on managing that list?  What is the means to join that trusted circle?  Do you know when your friends sell their phones back so you can decommission them from your circle? (If your answer is not ""no"" to the last one, you're probably not being realistic with yourself.)
Encourage creativity.  Build skills.  Get the kid a bunch of building blocks or a train.  Get a Spirograph.  Play cards/games with them.  Find something that they will play with for hours that doesn't require your constant attention.  
",4,2017-10-31 17:22:04Z,15
2,6,"
This puts the ""IOT"" in ""IDIOT!"".
Most of the companies that make these have no clue how to prevent hackers from taking them over, sometimes programming comically stupid/obvious exploits into them.
The KRACK exploit might be irrelevant half the time since most of these manufacturers wouldn't figure out how to implement some form of encryption.
Any type of internet-enabled voice recording is potentially creepy and downright dangerous invasion of privacy. These devices likely use the cloud for sound processing and storage considering they are almost certainly based on low-grade ARM chips and minimal cheap flash storage at most.
Even if the device is properly made, there's no similar guarantee on the cloud app it uses. You'd be surprised how often researchers happen to stumble on valuable leftover data in the cloud that the previous user of a logical machine instance failed to clean up.
",2,2017-11-01 04:44:14Z,16
3,1,"
Some people argue that code which is open source can be audited by many and therefor contains little bugs. On the other hand, attackers have the same easy access and also look for these same vulnerabilities. There is definitely a tradeoff here which is not correctly described in previous answers.
Others mention that code should be inherently secure and therefor requires no obfuscation/encryption/hiding. It is true that a system should be designed to be secure even if you know how it works. This doesn't mean that this is always the case AND the implementation is flawless. In practice, code is never 100% secure. (Take a look at web app security: Why do we need security headers to protect us against XSS and CSRF attacks if there are no vulnerabilities in the web application?) Additional security measures can be taken by trying to hide the code through encryption and obfuscation. In the mobile world, reverse engineering is even seen as a serious risk: OWASP Mobile Top 10 risks. 
As no system is 100% secure we can only try to increase the effort required to break it. 
So now, the tradeoff between open source/easily available code VS encrypted and obfuscated code. Allowing public review on you source code can help reduce the number of bugs. However, if you are a small company where the public has little incentive to freely audit your code, there is no benefit from publishing your code as nobody will look at it with good intentions. However, it becomes much easier for attackers to discover vulnerabilities. (We are not talking about the newest iOS version which every security researcher is trying to crack)..
In this case we aren't even talking about open sourcing the code for public review. We are talking about encrypting the firmware in transit. Security researchers are not likely going to buy your device to obtain the code to discover and publish vulnerabilities. Therefor the chance of having the good guys finding the vulnerabilities VS the bad guys finding them decreases.
",5,2017-09-05 07:50:19Z,18
3,2,"
No. You should not rely upon the obscurity of your firmware in order to hide potential security vulnerabilities that exist regardless of whether or not you encrypt/obfuscate your firmware.
I have a radical suggestion: do the exact opposite. Make your firmware binaries publicly available and downloadable, freely accessible to anyone who wants them. Add a page on your site with details on how to contact you about security issues. Engage with the security community to improve the security of your product.
",86,2017-09-01 13:38:54Z,21
3,3,"
Doubtful it would be beneficial. It is by far a better option to push it open-source than closed source. It might seem silly and even controversial at first, but opening up a project to the public has plenty of benefits.
While there are people with malicious intents, there are also people wanting to help and make the internet a better place. Open source allows more eyes to look over the project, not only to view about potential features, bugs, and issues but also increase security and stability of the ""thing""
And to agree with Polynomial's answer, engaging in a community and building a base of people that help you out with security, will increase the client base by a significant margin.
",11,2017-09-01 13:52:35Z,22
3,4,"
A well-designed firmware should rely on the strength of its access key rather than relying on the attacker's ignorance of the system design. This follows the foundational security engineering principle known as Kerckhoffs's axiom: 

An information system should be secure even if everything about the
  system, except the system's key, is public knowledge.

The American mathematician Claude Shannon recommended starting from the assumption that ""the enemy knows the system"", i.e., ""one ought to design systems under the assumption that the enemy will immediately gain full familiarity with them"".
You may be interested to know that prior to the late Nineteenth Century, security engineers often advocated obscurity and secrecy as valid means of securing information. However, these knowledge-antagonistic approaches are antithetical to several software engineering design principles — especially modularity.
",6,2017-09-01 18:33:32Z,24
3,5,"
Are you sure you are not confusing two cryptographic methods?
You should certainly sign your firmware updates for security reasons. This allows the device to verify they are from you.
To encrypt them adds a little bit of obscurity and that's it. Since the decrypting device is not under you control, someone sooner or later will hack it, extract the decryption key and publish it on the Internet.
",3,2017-09-02 05:49:21Z,25
3,6,"
You need to ask yourself this question.  Is someone clever enough and interested enough to download your firmware and start looking for vulnerabilities going to be deterred by an additional firmware encryption layer where the key must be revealed?
This is just another hoop to jump through, no different than figuring out what disk format your firmware image is in.  This isn't even a particularly difficult hoop to jump through.  Keep in mind that all FAR more sophisticated methods of what amounts to DRM have all been broken.
Odds are someone determined enough to hack your internet connected coffee maker/Dishwasher isn't going to be deterred by an additional encryption layer.
",0,2017-09-01 19:40:07Z,26
3,7,"
In the sense of ""will the encryption of firmware prevent the detection of vulnerabilities in my code?"" other answers have addressed the core of it: although it may discourage some attackers, security through obscurity leads to a false feeling of invulnerability that is counterproductive.
However, I'd like to add an extra bit on the basis of my experience. I have seen that the firmware packages are sometimes encrypted, but the motivation for that is only to preserve a company's intelectual property, rather than be a control against attackers.
Of course, hackers often find ways around this ""control"", but that's a different story.
",0,2017-09-08 06:53:14Z,27
3,8,"
Several people said you shouldn't rely on obfuscating the code by encrypting it, but to just make it secure. Quite recently the encryption of some rather critical software in Apple's iPhones was cracked (meaning that hackers can now see the actual code, no more). It stopped anyone from examining the code for three years, so the time from release to first crack has been increased by three years. That seems like some very successful obfuscation. 
And encryption goes very well together with code signing. So when your device is given new firmware, it can reject any fake firmware. Now that part isn't just recommended, that is absolutely essential. 
",-3,2017-09-01 21:03:46Z,28
4,1,"
Almost all IoT devices of the sort we are talking here (ie, consumer level) are deployed behind home grade routers (or ARE home grade routers) and are using IPv4 and NAT/uPNP to reach the internet.  That means they are sharing an IP with legitimate traffic for one and for another are using a dynamic IP, not a static IP, meaning there's even more opportunities for innocent parties to be caught up in such a blacklist.
Once the glorious world of IPv6 comes, we can likely do just that - assign each one a routable IP address and blacklist them as they get shown to be vulnerable.
One legitimate thing that CAN be done is for ISPs to perform source IP filtering - that is, don't let spoofed packets out, only let packets from IPs within the network.  That will help. Some.
",14,2016-10-26 17:08:31Z,33
4,2,"

wouldn't it make since to start giving IOT devices a static IP

No, because IPs only work in the proper network context.
An device's IP needs to be routable, which is to say, sitting on a network with routers that know how to communicate with other networks and are willing to do so on behalf of the device.
First of all, if you hardwire IPs and send them out, you'd have to use RFC1918 IPs (non-routable) to avoid conflicting with IPs owned by other people.  So you're already stuck with a narrow slice of addresses you can use.  And those IPs would need to be translated when they hit the Internet, thus removing the ability of the target to filter on them.
Second of all, you'd be handing people devices with IPs that may or may not match their networks.  They wouldn't want to rework their networks to accommodate your cheap IOT devices.
In short, a device's IP is set to allow it to work on the network.  Setting the IP and expecting the network to work with it breaks things.
",6,2016-10-26 17:07:52Z,35
4,3,"
The way IP addressing is done for IOT devices doesn't matter in a DDOS attack. Here is the reason why.

IOT devices may not always be exposed to network with an external IP address. 
It can also be device behind a NAT which has only an internal IP
address.  
So irrespective of whether it is DHCP or some static IP, provided by  the router to the device, from the DDOS attack victim's
perspective, the source of the attack is the external IP of the
router. 
In other words, if you have an IP cam at home, The packets from your IP cam as well as your laptop will have the same source IP address, ie the public IP address of your router. 
So filtering the packets based on source IP of the packet can deny service for your laptop as well.

",4,2016-10-26 18:06:32Z,36
4,4,"
No, as dynamic addressing isn't the attack vector when IoT devices get abused. It's poorly written software! On the DoS side, we have the 'underpowered' device vs. powerful computer problem, and on the connectivity side we have the ease of use vs. security problem.
Ironically, the only way to do proper IoT is to not connect them to the internet! At least a gateway plus locally configured outgoing tunnel would be needed before they can be connected at some sort of safe level.
",1,2016-10-26 17:49:55Z,37
4,5,"
A static IP would not help; as crovers mentions, due to ipv4 exhaustion, its just not practical. Although IPV6 provides a large enough address space for each device to have a staic IP address, there will still be a lit of overlap with the IPV4 world - where a server will just see lots of traffic arising from a point of presence for IPV6 nodes.
But there are a lot of things manufacturers and governments can do (to make up for the lack of skills on the part of the buying public). Blocking traffic ther than from/to the local network on an appliance by default, forcing a change of admin password before the device, using encryption appropriately, supporting open standards.
The goverment part is more tricky - the obvious solution isproviding an accreditation framework which is easily auditable but minimally invasive with minimum standards, the problem is that they tend to listen to either the ""experts"" advocating (for example) that all such devices should be fips-140 certified or the vendors bleating about customer freedom and over-regulation rather than seeking pragmatic solutions.
Maybe someone might set up an IETF to look at the classification problem.
",1,2016-10-26 18:12:42Z,38
5,1,"
I would suggest that rather than trying to protect the camera from the outside world with a firewall that using a black hole router as the only gateway for these devices would be more restrictive - also if you have a physical device at the router's address then it would make monitoring of egress attempts more visible. Also, point the device to the same black hole for DNS queries.
If you need remote access then use a VPN with NAT.
",3,2016-10-25 15:28:05Z,38
