Post ID,Title,Question,User ID,Vote Score,Answer Count,View Count,Date,URL,Full URL
1,How to eavesdrop and decrypt the HTTPs communication of an IoT device?,"
I am trying to setup a MitM scenario between an IoT device and WAN. It is possible and quite easy to achieve same thing for the application run on a mobile device by setting my proxy server(Fiddler)'s certificate is trusted. 
Since the IoT device that is being tested does not let you to make it consider the certificate as trusted, I am looking for the alternative methods. Is there any way to break in HTTPs connection and see all content as plain-text?
",2,0,1,165 times,2018-11-05 10:08:41Z,/questions/197028/how-to-eavesdrop-and-decrypt-the-https-communication-of-an-iot-device,https://security.stackexchange.com/questions/197028/how-to-eavesdrop-and-decrypt-the-https-communication-of-an-iot-device
2,IOT secure data transfer,"
I have a question about a monitoring software architecture. 
Think about 50 different locations in different cities. Assume that these locations are small plants.
In every location there are approximately 50 devices which produce small amounts of data which is a string and an integer counter. 
I need to take these data from devices and save them in a server database within the plant. 
Periodically I need to send these data from the server to HQ for reporting. 
I don't want to send data from plant to HQ in realtime as the connection might be down for a day or 2 between the plant and the HQ.
Assume that we don't trust plant operators and products can be stolen. E.g. 50 products are produced in the plant but only 40 are reported to HQ.
Basically, a string and an integer should be taken from a device and transmitted to the HQ in another city.
There are 3 places where data should be secured, I guess.

Between device and server. (Both are in the plant, they will be connected via ethernet or serial)
On the server  
Between the server and HQ

1) For the first path; device will be in a hard case which can't be opened by anyone except authorized personnel. 
Software on the device will have a SHA key and it will encrypt data and send to the server over serial or ethernet. Server will write encrypted or decrypted data to a database.  

Is encrypting data and sending it over TCP socket secure enough?  
As the device can't have a Hardware Security Module, the encryption key will be hardcoded and it will be in memory. Is there a way to secure the key other than locking it in a steel case?  
If the server has the same SHA key which is on the device, should it be on a Hardware Security Module?  

2) The server will be secured by a hard case and will be accessible by the HQ over the remote desktop connection as well. Antivirus and firewall software will be installed and configured.  
3) Should I again encrypt data on the server and send it over TCP sockets and decrypt at the center?  

Should I use a protocol like https and use REST?  
Do you recommend another solution?

",4,0,1,52 times,2018-10-16 16:29:46Z,/questions/195817/iot-secure-data-transfer,https://security.stackexchange.com/questions/195817/iot-secure-data-transfer
3,Proper security for IoT device,"
I'm developing a product with simple Cortex-M MCU (with no OS on board, firmware on bare metal) and internet connectivity via external module.
How do I make it secure? More specifically, how do I protect the data that is sent to and from the remote server?
My thoughts are:

I can't assume that firmware can be protected; since all users will have physical access to it - they eventually will find a way to dump it. Flash-read protection won't work, encrypting the flash won't prevent dumping it from RAM or something else.  
Using external encrypted flash/eeprom won't work for the same reasons.  
Relying on HTTPS on the external chip won't be enough because external module is connected to the MCU via UART and can easily be sniffed or tampered.

I have very basic understanding of cryptography but I know that I shouldn't invent my own, so I presume I'll have to encrypt all the data that is sent to the server by some well-known public key crypto. Probably using session keys.
But that still requires using one master secret key on the device and I don't know how to store it securely due to 1).
Any ideas? Is there a well-known bulletproof solution?
Or I should just generate random keys for every device (not derived from device ID or anything like that)? So if one device is compromised it won't affect the whole network - and that's about it?
UPD: Clarification - I don't want to allow device owner to impersonate other devices and upload false data (about other devices) to the database.
",7,2,2,87 times,2018-10-14 19:18:06Z,/questions/195666/proper-security-for-iot-device,https://security.stackexchange.com/questions/195666/proper-security-for-iot-device
4,Penetration testing or Malware analysis? [closed],"
My M.Sc research is about developing IDS for IOT.
I'm confused about which field should learn more about; penetration testing or malware analysis.
I have some knowledge about each one but for IDS, which is working with malware, I don't know which field I should focus on!
I'll use AI (Deep Learning) for building an IDS based on Contiki and cooja platform.
",9,-2,1,43 times,2018-10-07 11:44:41Z,/questions/195242/penetration-testing-or-malware-analysis,https://security.stackexchange.com/questions/195242/penetration-testing-or-malware-analysis
5,Lightweight terminal protocol for IoT,"
For IoT devices with limited resources (e.g. embedded system with 32 kB RAM, 128 kB Flash memory, running an RTOS such as FreeRTOS, small TCP/IP stack such as lwIP):
It might be useful to have a terminal type protocol for debugging or testing. However, telnet is not secure, while SSH seems sufficiently complicated so that it's difficult to implement and fit into such a small system.
Are there any lightweight yet secure terminal protocols that are suitable for such a resource constrained IoT system?
Pragmatically, is it possible to cut down SSH to a lean implementation, e.g. with AES but no 3DES, even though the latter is technically mandatory for a conformant SSH implementation?
",11,1,1,42 times,2018-09-06 01:54:27Z,/questions/193142/lightweight-terminal-protocol-for-iot,https://security.stackexchange.com/questions/193142/lightweight-terminal-protocol-for-iot
6,Do I need Gateway Firewall for IoT network? [closed],"
Do I need a gateway firewall to prevent attacks like DoS, if my IoT network can only talk to cloud using IPsec?
Even if  there is need that can be implemented at cloud. Is there any need for it to present in IoT network?
",14,1,2,43 times,2018-09-01 12:04:17Z,/questions/192840/do-i-need-gateway-firewall-for-iot-network,https://security.stackexchange.com/questions/192840/do-i-need-gateway-firewall-for-iot-network
7,What is the risk of running a IOT device exposed to the internet using non https port?,"
I have a IOT device in my home that controls my security system and let me enable/disable it.
It can be accessed via web interface and a mobile app. It's unknown to me what OS or other ports that may be open or other aspects. I only interface with it that way.
The device has a built-in DDNS-like service that lets me redirect to the device without knowing my IP.
I have the following settings I can enable or disable: 
ENABLE HTTPS ON CUSTOM PORT
SET DEFAULT HTTP PORT
SET ""SOFTWARE"" PORT

I enabled HTTPS on a high port and set the http port to 0. However if I do that with the software port the mobile app wont work. I don't know if this port is working with https or http, or even if my mobile app connection to it is encrypted. The software port is not accessible on the browser. The HTTPS port is not accessible outside LAN by router rules.
What is the risk posed by this device if I expose it to the internet with a possibly plain HTTP port?  Is there anything I can do to mitigate this risk? 
My goal here is to have the device accessible externally, and communicate with it securely with the mobile app, and limit risk of it infecting other devices in my network if compromised.  
",16,1,1,75 times,2018-08-06 08:43:46Z,/questions/191031/what-is-the-risk-of-running-a-iot-device-exposed-to-the-internet-using-non-https,https://security.stackexchange.com/questions/191031/what-is-the-risk-of-running-a-iot-device-exposed-to-the-internet-using-non-https
8,Robust SSL pinning on IoT device with Let’s Encrypt,"
I would like to implement SSL pinning on ESP8266. Since leaf certificate is changing quite often I would like to check for which domain leaf was issued and check that root belong Let’s Encrypt.
To which property should I pin in root? I would like to avoid the situation when certificate expires and I would need to re-flash my device.
",17,1,1,116 times,2018-07-26 09:22:58Z,/questions/190409/robust-ssl-pinning-on-iot-device-with-let-s-encrypt,https://security.stackexchange.com/questions/190409/robust-ssl-pinning-on-iot-device-with-let-s-encrypt
9,What kind of IoT devices use certificates?,"
I have read that PKI certificates are the main way to provide security on IoT platforms. And the common enrollment protocols for certificates are:

SCEP (Simple Certificate Enrollment Protocol) 
EST (Enrollment over Secure Transport) 
CMP (Certificate Management Protocol) 
CMC (Certificate Management over CMS)

(CMP is the one which is used for securing LTE eNodeBs.) 

Now what is not clear is what devices get the certificates? I am assuming that sensors etc are too small to get certificates and use them? So is anything used for securing sensors in IoT? I think gateways can use certs but gateways probably don't need these protocols - they are not really IOT devices. Also what do the gateways use the certs for - is it to communicate with the cloud servers or is it to communicate with the gateways?  
So what kind of IoT devices use these protocols to enroll certs? How do they use the certs? Do they use it only for authentication? Or also for encrypting communication? Are they sophisticated enough to do this?
",20,0,3,219 times,2018-06-19 12:33:16Z,/questions/187941/what-kind-of-iot-devices-use-certificates,https://security.stackexchange.com/questions/187941/what-kind-of-iot-devices-use-certificates
10,Security Advantages of Azure Sphere vs other embedded OS,"
I know Azure Sphere is new, and to my understanding Microsoft is targeting the embedded IOT market, but how is Azure Sphere more secure than other embedded RTOS systems like VxWorks or Integrity? Don't many of the embedded security measures mentioned at https://www.microsoft.com/en-us/azure-sphere/details/ already exist in most embedded devices? Is it their combination of using hardware and software security measures that will give Azure more security than normal embedded operating systems?
What separates Azure Sphere from other security focused embedded operating systems?
",22,0,1,104 times,2018-04-25 18:09:37Z,/questions/184601/security-advantages-of-azure-sphere-vs-other-embedded-os,https://security.stackexchange.com/questions/184601/security-advantages-of-azure-sphere-vs-other-embedded-os
11,Which are the most dangerous and popular botnets that came from IoT devices?,"
The ease of taking control of a cheap IoT device makes them the perfect target to craft a botnet to perform DDoS attacks. 
I heard about botnets created from a lot of hacked IoT devices used to create DDoS attacks on websites.
How much of this information is true? Is there an existing common threat about IoT botnets nowadays? Which were the most popular IoT botnets and attacks?
",25,-1,2,220 times,2018-04-23 10:03:25Z,/questions/184365/which-are-the-most-dangerous-and-popular-botnets-that-came-from-iot-devices,https://security.stackexchange.com/questions/184365/which-are-the-most-dangerous-and-popular-botnets-that-came-from-iot-devices
12,Which are the most common vulnerabilities for poor crafted IoT devices? [closed],"
I'm learning about securing IoT devices and starting to learn how to develop my own software for them. 
I wanted to know which are the most common vulnerabilities that any scriptkiddie could exploit and how to be aware of them in general terms. 
I'm in a very initial stage, so any tip or information regarding:

Popular vulnerabilities in devices or brands
Securing typical sofware for cameras/sensors/small devices...
Tools for pentesting devices/examples

",25,0,2,70 times,2018-04-20 08:44:22Z,/questions/184139/which-are-the-most-common-vulnerabilities-for-poor-crafted-iot-devices,https://security.stackexchange.com/questions/184139/which-are-the-most-common-vulnerabilities-for-poor-crafted-iot-devices
13,Does LoraWan protocol's Over The Air Activation run Diffie Hellman?,"
I am looking at the LoraWan protocol specification and I want to capture the over the air activation of a device. So far I have seen the:
https://zakelijkforum.kpn.com/lora-forum-16/over-the-air-activation-otaa-8323
As it seems that it is using nonces in order to generate the key, I thought, ""Hey it seems like Diffie Hellman to me.""

Is the Over the air activation in LoRaWan is as the link mentions?
If yes, is Diffie Hellman the key exchange being used?

",29,0,1,79 times,2018-03-25 16:22:26Z,/questions/182113/does-lorawan-protocols-over-the-air-activation-run-diffie-hellman,https://security.stackexchange.com/questions/182113/does-lorawan-protocols-over-the-air-activation-run-diffie-hellman
14,ESP8266 Dash Button Security,"
I have built a dash button using ESP8266 microcontroller. The microcontroller should make a response to a ASP.NET WebApi Rest Service to trigger an action. How can i make this api call secure. The action should only be triggered from this specific microcontroller. Replaying the Api Call may not be possible. 
How can i archive this?
I think about challange response with a secret both client(esp8266) and server knows.
",31,3,1,61 times,2018-03-21 20:02:50Z,/questions/182010/esp8266-dash-button-security,https://security.stackexchange.com/questions/182010/esp8266-dash-button-security
15,Is using both client side certificate and JWT for IoT device redundant?,"
Is there a case to be made for authorizing with both a client side certificate and JWT for an IoT device?
Are JWTs good enough (assuming following of the specs)?
And if client side certs are truly needed, what of expiration dates? (set the client cert expiration way out into the future, etc)?
",34,1,2,257 times,2018-02-07 16:09:08Z,/questions/179315/is-using-both-client-side-certificate-and-jwt-for-iot-device-redundant,https://security.stackexchange.com/questions/179315/is-using-both-client-side-certificate-and-jwt-for-iot-device-redundant
16,How to keep Internet of Things projects secure? [closed],"
I want to experiment with the use of sensors for data logging and potentially for automated actions based on data properties. An example of the latter is if a value being monitored exceeds a threshold for X amount of intervals, some kind of notification or response is triggered, whether an LED lighting up or email being sent out.
I'm not an expert about sensors, networking, IoT, robotics, scripting, machine learning, or programming in general. That's all part of the learning process. I know enough to know security is important and easier to achieve if it's a goal from the beginning. So my question as I embark on this learning excursion is, what do I need to be aware of or control for to keep these systems safe as I create and experiment with them? If that question is so broad a book answers it, could you recommend a learning resource? Where does one start for learning how to keep home brewed IoT systems secure?
I realize this depends on two major things: security is harder as complexity increases; and security depends on threat models. Well, my simple sensor systems are bound to get more complex if I pursue more significant projects with them, thus the importance of good security that scales from the start. As for threat models, I don't anticipate enemies and these would all be relatively low-value and plentiful targets (many sensors monitoring basic things) but I do expect there are malicious agents seeking to control any processing power they can or disrupt systems just for the sake of chaos. Lastly as an importart part of the threat model is physical security, because if I put a sensor outside with a solar panel to power it, how do I stop mischievous kids or crooks from destroying or stealing the technology?
",40,3,5,172 times,2018-02-02 20:45:41Z,/questions/179009/how-to-keep-internet-of-things-projects-secure,https://security.stackexchange.com/questions/179009/how-to-keep-internet-of-things-projects-secure
17,How do you change the password of an IoT device like a DVR box?,"

The above picture is Brian Krebs responding with advice about protecting yourself from the IoT hacks.  It's common advice given for protecting IoT devices from attacks like the Mirai botnet.  
My question is, what does it mean? Supposedly the biggest category of devices compromised were webcams and DVR boxes. What does it mean to ""change the password"" of a DVR box? A webcam? Or any other IoT device (a coffee-maker password?) If I have a device that uses UPnP, where is its ""password""? Those devices just plug in, and work. Never seen a coffee pot ask for credentials before.
",42,1,1,61 times,2018-01-31 23:03:10Z,/questions/178843/how-do-you-change-the-password-of-an-iot-device-like-a-dvr-box,https://security.stackexchange.com/questions/178843/how-do-you-change-the-password-of-an-iot-device-like-a-dvr-box
18,Is a PKI for the IoT really a good idea?,"
I am reading a bit about the security of IoT devices and found quite a lot of articles describing how a PKI would be an improvement for the current infrastructure. I am, however, not convinced if setting up a PKI would improve security for most of the IoT use cases. I was wondering if I was seeing something incorrect. To give an example:
I understand how IoT devices used in Industrial Control Systems would benefit from a PKI, since they usually communicate without the interference of users and therefore cannot use traditional methods for authentication like passwords, biometrics and tokens. 
For the more basic use cases like cameras, microwaves or refrigerators that are connected to the internet, I don't see the added value of a PKI. Am I overlooking something, or does PKI indeed not improve security for these devices?
Edit: some examples:

https://www.scmagazine.com/pki-for-the-internet-of-things/article/539469/
https://techbeacon.com/managed-pki-certificates-securing-internet-things

",43,18,1,"4,254 times",2018-01-22 10:50:58Z,/questions/178134/is-a-pki-for-the-iot-really-a-good-idea,https://security.stackexchange.com/questions/178134/is-a-pki-for-the-iot-really-a-good-idea
19,Is it safe to use an auto pay feature on my smart watch that stores card info?,"
(So guess what I got for Christmas...)
While I do appreciate the tech and some of the features in the smart watch, I am skeptical of it's biggest feature -- the Pay feature which essentially duplicates your credit card's magnetic info and stores it within the watch (or the phone it is paired with? not sure on that). It is great to just walk up to a payment terminal and bring your wrist close to it and the smart watch does the payment for you by surrendering the stored card info. Not that it is such an awesome feature that I would buy a smart watch for that, but since I have it now I am thinking of using it.
Making my question more generic to all smart watches and IoT devices that have such auto-pay features: from a security standpoint, how safe is it to store your credit card's magnetic info on a smart watch like that? Is it about as safe as storing it on your phone or on a website like Amazon? I worry that a smart watch's OS might be easier for attackers to target since it is more likely to have security vulnerabilities than a more mainstream and major OS like Red Hat or Mac OsX (not saying these don't have major vulnerabilities but still...). So if I have my credit card stored at a bunch of places like Amazon, Android phone, smart watch etc., attackers are more likely to target something like a watch to steal it from. Am I correct in this assumption?
Side note: I confess that I do not yet fully understand how the watch is able to act like a credit card to make payment at terminals. From what little I understand, it stores some limited one-time ""payment tokens"" that allow it to make payments.
",44,0,1,51 times,2017-12-28 01:07:50Z,/questions/176233/is-it-safe-to-use-an-auto-pay-feature-on-my-smart-watch-that-stores-card-info,https://security.stackexchange.com/questions/176233/is-it-safe-to-use-an-auto-pay-feature-on-my-smart-watch-that-stores-card-info
20,Port-forwarding to a web server on Raspberry Pi,"
I've recently created a relatively simple smart Christmas tree which is a Raspberry PI Zero W powered LED strip.
In order to control it via IFTTT webhooks, I've started a lightweight flask server on the Raspberry Pi - on a specific port with several endpoints for different animations/patterns. Then, on the home router, I've configured port-forwarding to the flask server started on the Raspberry Pi.   
Currently, the flask API is completely open, - though, one, in order to use it, would need to know the IP address and the port values.
The risks in terms of security in this particular case are, of course, minimal, but what are the general ways to improve the security of this home automation setup? Should I go for a full-fledged web server like Apache?
I was thinking to at least require a ""secret"" key in a cookie, which the IFTTT recipes and the flask server would only know. Since the resources of the device are limited, I guess, performance & security need to be carefully balanced.
",45,2,1,694 times,2017-12-23 05:13:05Z,/questions/176022/port-forwarding-to-a-web-server-on-raspberry-pi,https://security.stackexchange.com/questions/176022/port-forwarding-to-a-web-server-on-raspberry-pi
21,What are some interesting project ideas that use machine learning to solve issues in IOT security? [closed],"
I am interesting in IOT security and machine learning/deep learning. I am looking for good project ideas to work on. 
example: http://projectabstracts.com/20138/a-malicious-pattern-detection-engine-for-embedded-security-systems-in-the-internet-of-things.html
",14,0,1,800 times,2017-12-21 15:35:58Z,/questions/175928/what-are-some-interesting-project-ideas-that-use-machine-learning-to-solve-issue,https://security.stackexchange.com/questions/175928/what-are-some-interesting-project-ideas-that-use-machine-learning-to-solve-issue
22,How safe are wifi enabled talking toys?,"
There have been ads on the radio recently for a wifi enabled toy called Talkies, which are advertised as being able to communicate with app enabled phones, with a ""trusted circle"" that other phones can be added to.
(Obligatory photo of a cute wifi enabled critter)

Especially considering the Krack vulnerability, and the known process of ""grooming"" a child that a sexual or other predator goes through to gain their trust and exploit them (Here is a story about how Snapchat was used), is this a toy that I should steer away from for my child? (3 years old currently)
",52,50,6,"10,788 times",2017-10-31 19:19:44Z,/questions/172553/how-safe-are-wifi-enabled-talking-toys,https://security.stackexchange.com/questions/172553/how-safe-are-wifi-enabled-talking-toys
23,how to implement TLS between web-server and embedded devices,"
I am working on remote light control system. The devices/controllers are like raspberry pi sized units running embedded programs to accept commands from a management application running on remote web-server. The devices are deployed in the field (street) and connected to internet via  GPRS & Ethernet.
There are hundreds of such devices not having host-name and their IP is not static. So SSL certificates may not be possible here???.  
Does the ""shared secrete"" approach works best here? but then distributing these keys to already existing devices would be challenging as it cannot be done over insecure OTA.
",54,0,3,719 times,2017-10-26 16:37:43Z,/questions/172226/how-to-implement-tls-between-web-server-and-embedded-devices,https://security.stackexchange.com/questions/172226/how-to-implement-tls-between-web-server-and-embedded-devices
24,Additional risks to home network in exposing (raspberry pi) honeypot to the internet,"
While I would like to contribute piping of logs from a home-deployed honeypot to the DSHIELD project using a raspberry pi, I am concerned that the additional exposure of the port to the internet would provide:

A wider exposure surface
An additional endpoint for attackers to compromise potentially, which they could then use as a pivot point to do loop-back attack to other IOT or devices within the home network that may not have been exposed to the internet.

Would anyone be able to advise if the above additional risks are correct, and what would be a reasonable solution to place for a home network environment please?
",56,1,1,188 times,2017-10-23 06:19:18Z,/questions/171928/additional-risks-to-home-network-in-exposing-raspberry-pi-honeypot-to-the-inte,https://security.stackexchange.com/questions/171928/additional-risks-to-home-network-in-exposing-raspberry-pi-honeypot-to-the-inte
