Post ID,Title,Question,User ID,Vote Score,Answer Count,View Count,Date,URL,Full URL
25,Secure operation of IoT equipment?,"
In the light of recent events around Mirai not being the only IoT botnet, but being joined by IoTroop / IoT_reaper (see here and here ), I wondered what steps need to be taken to securely operate an IoT device. Obviously, just plugging the device into your public-IP internet connection is unwise. But I don't feel that this is the usual deployment scenario. My personal setup is a rather typical home-user's: ISP -> cable modem -> wireless router, and all computers/devices behind this router. This means that there is some firewalling between any given device and the internet. As far as my experience from several companies and universities goes, there is a similar amount of firewalling, if you'd plug your IoT device into any of their company-in-house-network sockets.
So, the first part amounts to the question: What (network) attack vectors need to be considered?
In the above-mentioned setup I regarded the IoT-device as not directly accessible from the internet. This does not seem to be true in the presence of an UPnP-enabled router. On several sites I found that deactivating UPnP increases your security. By my mediocre understanding what UPnP does, this seems very logical, as I don't want insecure devices to poke holes into my firewall. But the same sites that suggest turning UPnP off, never seem to mention what possible side-effects this might have. (I read that some software like Windows Live Messenger relys on UPnP?)
Without UPnP, and without manually redirecting any ports to my IoT device, it seems that my IoT-device would need to make active connections. I can imagine two reasons to make such connections: Connecting to an automatic firmware upgrade mechanism, and to connect to a manufacturer/third-party service, which allows the device to be available from outside of my LAN (e.g. like the Ivideon service).
So, the second part of the question is: Do these active connections pose a threat? (Given that any accounts on such sites have decent passwords.) Does one need to be afraid of man-in-the-middle attacks on the FW-upgrade mechanism, or maliciously altered FW-images?
But what else am I missing out? 
[ Of course, there are two most-basic suggestions, one hears on a daily basis: Change default passwords and apply firmware updates (if the manufacturer even cares to provide them). ]
",59,1,2,111 times,2017-10-22 14:24:25Z,/questions/171893/secure-operation-of-iot-equipment,https://security.stackexchange.com/questions/171893/secure-operation-of-iot-equipment
26,Managing https security for IoT gateways,"
My company is a IoT-Gateway manufacturer. Customers are increasingly getting serious about security issues in the IoT domain. Additionally, governments require dedicated security features as HTTPS for embedded web severs.
For example, the German government agency for security in IT-systems (BSI) requires to use ""TLS 1.2 in combination MIT Perfect Forward Secrecy"" as minimum security.
My questions are: 

From an IoT manufacturer's point of view, is an ""upload certificate"" feature in the IoT device sufficient to ensure certificate security?
Are there already a standard API (or RFC) to replace certificates? Considering large IoT installations the replacement and management of certificates is defitively a big challenge.
How do companies manage the HTTPS certificate infrastructure for IoT devices today? Are self-signed certificates used in Intranets or official certificates? Does every IoT gateway get a different certificate? Do companies operate private certificate authorities?

",61,1,2,176 times,2017-09-29 17:17:56Z,/questions/170371/managing-https-security-for-iot-gateways,https://security.stackexchange.com/questions/170371/managing-https-security-for-iot-gateways
27,Should firmware images for IoT be encrypted for security reasons?,"
When working with Internet of Things devices, is it recommend to obfuscate or encrypt firmware images pushed to clients? This to make reverse engineering harder.
(They should be signed of course)
",70,27,8,"5,271 times",2018-02-05 11:27:54Z,/questions/168620/should-firmware-images-for-iot-be-encrypted-for-security-reasons,https://security.stackexchange.com/questions/168620/should-firmware-images-for-iot-be-encrypted-for-security-reasons
28,How to brute force a login page of an IP camera created in .asp?,"
I am new to stackexchange. I desperately need some help. I am doing my thesis on 'IoT Threats', one of my objectives is to try to brute force into an IP camera. I am using Kali Linux Hydra to do the brute force, however I have not been successful in completing this, I know the method I am using is not the correct one, I think, I don't know :( 
All the examples I have looked shows only how to do a brute force for the extension .php?. The login page of the IP camera I am testing however is in .asp , and I do not see any <form> in the source code of the login.asp page. The login url created when you visit http://192.168.1.3:85 is

http://192.168.1.3:85/doc/page/login.asp?_1503752871126

(GET method is used, checked via Wireshark,
HTTP requests to /PSIA/Custom/SelfExt/userCheck)
I need your help with the below:

Can I use brute force using hydra for .asp ?
If yes how does the command look like ?  I used


hydra -l admin -P wordlist.txt 192.168.1.3 -s 85 http-form-get '/PSIA/Custom/SelfExt/userCheck:lausername=^USER^&lapassword=^PASS^:User name or password is incorrect:H=Authorization: Basic YWRtaW46QkM1MUZFOTUyRkI3' -V


If not how can I get access to this IP camera like a cracker? 

Other Information nmap: 
OPEN PORTS: 

23 - telnet BusyBox telnetd,
85 - http Hikvision IP camera httpd,
443 - ssl/http Hikvision IP camera httpd,
554 - rtsp Hikvision 7513 POE IP camera rtspd,
7001 - afs3-callback?,8000 - http-alt?,
8200 - trivnet1?

kindly advise.
",72,3,1,"1,116 times",2017-08-28 11:41:24Z,/questions/168329/how-to-brute-force-a-login-page-of-an-ip-camera-created-in-asp,https://security.stackexchange.com/questions/168329/how-to-brute-force-a-login-page-of-an-ip-camera-created-in-asp
29,Why do cellphones not use software to simulate a NAT router between the phone and the internet?,"
Connecting through wifi adds the benefit of being behind NAT. Why do cellphones not simulate being behind a nat network when connecting directly to the internet to limit the attack surface? Or, is there software that has implemented this?
",73,2,1,100 times,2017-07-19 16:18:07Z,/questions/165569/why-do-cellphones-not-use-software-to-simulate-a-nat-router-between-the-phone-an,https://security.stackexchange.com/questions/165569/why-do-cellphones-not-use-software-to-simulate-a-nat-router-between-the-phone-an
30,Could someone execute an assassination by exploiting a connected thermostat? [closed],"
With connected thermostats such as the Nest gaining popularity due to their convenience, I've been wondering for a while about the potential for exploiting its intended function rather than just using it as an entry point into a network. Every summer you hear about people dying due to overheating, and it occurs to me that someone with malicious intent could take control of a connected thermostat and raise the temperature high enough to potentially kill someone in their sleep?
For example, are there any safeguards built into a Nest thermostat at the hardware level to prevent someone from raising the temperature to 100+ degrees or forcing the furnace to remain on constantly?
Are there any known examples of this, and is there any practical way to mitigate the risk aside from not using a connected thermostat or using a strong, unique password to protect the account tied to the device?
",74,-4,1,89 times,2017-07-07 15:43:53Z,/questions/163614/could-someone-execute-an-assassination-by-exploiting-a-connected-thermostat,https://security.stackexchange.com/questions/163614/could-someone-execute-an-assassination-by-exploiting-a-connected-thermostat
31,Does still make sense to use SHA1?,"
I'm working with Arduino and hash-based signatures which are signature schemes that use only hash functions. Due to the constraints of an Arduino I was thinking about using SHA1 as the underlying function of my hash-based signature. But I'm not sure if it still makes sense to use SHA1 due to its vulnerabilities. Is there a scenario in which would be acceptable to use SHA1?
",77,4,2,332 times,2017-06-26 17:28:45Z,/questions/162779/does-still-make-sense-to-use-sha1,https://security.stackexchange.com/questions/162779/does-still-make-sense-to-use-sha1
32,"How to detect, if ESP32 or ESP2866 IoT devices hide malicious in their firmware?","
ESP32 and ESP2866 devices are very famous as cheap IoT controller and connect via wireless LAN. 
Unfortunately the firmware of these devices is still closed source and quite large. It is there any chance to detect, if malicious software is shipped in the firmware, which opens backdoors or harms the network?
",78,0,1,297 times,2017-06-15 19:12:29Z,/questions/162045/how-to-detect-if-esp32-or-esp2866-iot-devices-hide-malicious-in-their-firmware,https://security.stackexchange.com/questions/162045/how-to-detect-if-esp32-or-esp2866-iot-devices-hide-malicious-in-their-firmware
33,How would an external attacker utilise universal plug and play to bypass a firewall?,"
I'm wondering what strategies and techniques are used to bypass firewalls which have universal plug and play.  I'm aware of security issues regarding UPNP in the past but I've also heard that there are some persistent vulnerabilities with UPNP that have not been patched, presumably because it would negatively effect the usability of UPNP.
In this scenario, I am examining how an Internet of Things embedded device might be insecure despite of being placed behind a home firewall.  Assuming the device had FTP enabled and no further controls on it, so that a simple FTP cracking attack would suffice, how would these UPNP firewall bypassing techniques be used to establish an unfiltered connection between the IoT device and said attacker?  
",79,3,1,127 times,2017-05-31 20:44:18Z,/questions/160878/how-would-an-external-attacker-utilise-universal-plug-and-play-to-bypass-a-firew,https://security.stackexchange.com/questions/160878/how-would-an-external-attacker-utilise-universal-plug-and-play-to-bypass-a-firew
34,How to secure JavaScript-enabled login page without TLS,"
I am involved in an IoT project with single pager web UI. Unfortunately, as it was discovered in a hard way, TLS stack is not viable on the selected platform. The alternatives I've found for securing the XMLHTTPRequest traffic relay on integrity and authenticity of the bootstrap/login page. Is it safe to assume that in local networks attackers will not be able to intercept a request for login page from a browser to a device and send a hijacked login page instead with malicious JavaScript?
",81,1,1,144 times,2017-05-08 17:20:57Z,/questions/159040/how-to-secure-javascript-enabled-login-page-without-tls,https://security.stackexchange.com/questions/159040/how-to-secure-javascript-enabled-login-page-without-tls
35,"What strategy would one utilise in order to breach an entire network, after gaining access to an embedded device on said network?","
I am currently researching IoT security and am trying to find out about how a single device with poor password security on a network could be utilised to gain access to the other components of said network.
Let's assume that it's an embedded device running some kind of Linux distribution.
I'm trying to write about the implications of poor password security for IoT devices, and why you should care even if it's a mundane device that controls no private data.
",79,2,1,62 times,2017-04-25 15:01:58Z,/questions/158097/what-strategy-would-one-utilise-in-order-to-breach-an-entire-network-after-gain,https://security.stackexchange.com/questions/158097/what-strategy-would-one-utilise-in-order-to-breach-an-entire-network-after-gain
36,Cloud Data collection regulation [on hold],"
IF an examiner finds credentials for a cloud storage account is it acceptable to use the credentals to login and preserve,collect,produce,present ?
What cirmustance can this be done and should not be done ? 
In this case, a private investigator coducting an investigation for a university has found credintals for a students uni google drive account.
Is there an ISO doc that has guidelines on this ?
",84,0,1,52 times,2018-11-06 14:48:05Z,/questions/197058/cloud-data-collection-regulation,https://security.stackexchange.com/questions/197058/cloud-data-collection-regulation
37,Is it safe to keep my KeePassX database on my server or cloud with encryption? [duplicate],"

My KeePassX file has a long and strong password. 
I've read several articles and discussions about how safe it'll be stored such a file on VPS or cloud service such as Dropbox. There was no consensus in the discussions.
I'm aware of a possibility that storage or my server can be hacked, or a staff member would copy my file to her computer and try to guess my password -- this is what my question is about too.
Finally, how safe is this if my file protected by long enough password by itself not encrypted by some other tool unrelated to KeePassX? If the worst happens -- my file gets stolen by a hacker.
I need a simple and succinct answer without any ""if...then"", ""if not....""
",86,1,1,69 times,2018-10-06 20:15:09Z,/questions/195212/is-it-safe-to-keep-my-keepassx-database-on-my-server-or-cloud-with-encryption,https://security.stackexchange.com/questions/195212/is-it-safe-to-keep-my-keepassx-database-on-my-server-or-cloud-with-encryption
38,Amazon EC2 Abuse Report,"
My company recently received an email from Amazon which notified us of malicious activities occurring on our running EC2 Instance. 
The email states:
We observed machines under your control participating in a DDoS attack
targeting Google IPs.
The attack was a UDP amplification attack. In this attack, a UDP-based
service is abused to attack others, wasting your bandwidth and computing
resources.
I am fairly new to all of this stuff in addition to AWS and have no idea as to where to start. What should be the first steps for me to take to mitigate this?
After running the commands from @ximaera
Davids-MacBook-Pro:~ davidpham$ ntpdc -nc monlist *ip*
*ip*: timed out, nothing received
***Request timed out
Davids-MacBook-Pro:~ davidpham$ dig @ip +edns=0 +ignore com ANY

<<>> DiG 9.10.6 <<>> @ip +edns=0 +ignore com ANY
; (1 server found)
;; global options: +cmd
;; connection timed out; no servers could be reached
Davids-MacBook-Pro:~ davidpham$ 

This was the output I received. Am i missing something?
",88,2,1,187 times,2018-10-10 22:21:06Z,/questions/195164/amazon-ec2-abuse-report,https://security.stackexchange.com/questions/195164/amazon-ec2-abuse-report
39,What are some attacks to consider in a cloud deployment?,"
I want to discuss the following scenario: 
I use a cloud provider like Amazon where every instance of the OS is a VM. The hypervisor launches the VMs as needed. So let's assume there are two VMs running, mine and attacker's on the same box at the same time.
Scenario 1: The attacker has root access to his VM. But does not have physical access to the box. What attack vectors do I worry about? 

Obviously any vulnerabilities in my VM (OS and services it provides).
  Let's assume this is out of scope for this discussion
Vulnerabilities in the hypervisor that lets the attacker intercept all data to and from my VM. 
  Are there known vulnerabilities like this? 
Any other scenarios like DMA attacks? 

Scenario 2: The attacker has physical access to the box. He manages the box and is able to install custom hardware or use the peripherals like USB, HDMI etc? 

I know that one can introspect the VM he wants to attack directly as software-based attacks are easier. Let's assume it's out of scope.

",89,1,1,67 times,2018-10-04 19:37:44Z,/questions/195072/what-are-some-attacks-to-consider-in-a-cloud-deployment,https://security.stackexchange.com/questions/195072/what-are-some-attacks-to-consider-in-a-cloud-deployment
40,Security risks of exposing a VM to single IP address on the Internet,"
I have a small office network with about 10 workstations and a single physical domain controller. I want to move it to the cloud. For that, I deployed a Windows VM on Azure, which I'm going to promote as an additional DC. Then, I'll shut down the physical one.
Currently the physical server also serves as a VPN server, and the cloud VM is connected to the local office network via this VPN with L2TP and IPSec. When I'll shut down the physical server, it will also kill the VPN.
I thought about exposing the cloud VM itself to the office, instead of initiating a connection from it. On Azure, I have the ability to expose the VM to all traffic from a single IP address on the Internet. This way I can use the office's external static IP and the workstations will be able to communicate with the cloud DC.
My question is, what realistic security risks are involved in this process? Would it be easy to exploit, even when I expose it only to a single IP address? Should I avoid this strategy and keep the VPN approach?
",92,0,3,96 times,2018-08-11 18:11:39Z,/questions/191392/security-risks-of-exposing-a-vm-to-single-ip-address-on-the-internet,https://security.stackexchange.com/questions/191392/security-risks-of-exposing-a-vm-to-single-ip-address-on-the-internet
41,Privacy of client's virtual machine in cloud computing,"
As we know clients can create and run their virtual machines (VM)in the cloud computing. My question is about the confidentiality of data stored in the client's VM.
Question 1: Does data stored in a client's VM remain private in the cloud? Is the cloud able to read the data?
Question 2: Is there any way to hide data (e.g. secret keys) stored in the client's VM? 
",94,0,2,80 times,2018-07-20 09:23:49Z,/questions/190003/privacy-of-clients-virtual-machine-in-cloud-computing,https://security.stackexchange.com/questions/190003/privacy-of-clients-virtual-machine-in-cloud-computing
42,Safely connect to remote site from cloud based code,"
I am connecting my computer located at my home to a remote server. 
To communicate with the server, I use a config file that contains my private and public keys and a passphrase. My code reads the config file and sends a message containing the signature from the private key, the public key and the passphrase.
Now, I would like to run my code on the Cloud, for example AWS.
I suppose it is not safe to store the config file on AWS, so what would be the correct way to connect safely from AWS to the remote server ?
",96,1,1,31 times,2018-06-26 08:27:06Z,/questions/188473/safely-connect-to-remote-site-from-cloud-based-code,https://security.stackexchange.com/questions/188473/safely-connect-to-remote-site-from-cloud-based-code
43,How does security work in a cloud-to-cloud backup scenario?,"
I'm thinking of using Spinbackup which is a cloud-to-cloud backup of gmail, but I was resistant to the idea of telling Spinbackup my gmail password for obvious reasons. However, on the Spinbackup security page it says this:

Spinbackup never requires Google user credentials. We don’t store your
  passwords on our servers. It cannot access passwords as it uses OAuth
  2.0 to access your Google account data, the latest Google API, which allows two-step verification.

My common-sense reaction is that surely if someone has the privilege to back up my email, then that they can also read my email (and probably send email on my behalf too). Without going in to all the details about OAuth2, can someone explain what the above statement means and what security it offers?
",97,3,1,52 times,2018-05-25 11:38:52Z,/questions/186486/how-does-security-work-in-a-cloud-to-cloud-backup-scenario,https://security.stackexchange.com/questions/186486/how-does-security-work-in-a-cloud-to-cloud-backup-scenario
44,Penetration Testing of IaaS/PaaS environment - CVSS Score,"
How can I measure the effectiveness of a Penetration Testing carried out in a Cloud Environment (IaaS/PaaS) by a third Party Vendor ? Should I ask for a CVSS score or something else ?
Any advise will be highly appreciated.
",99,1,1,97 times,2018-05-21 01:04:34Z,/questions/186164/penetration-testing-of-iaas-paas-environment-cvss-score,https://security.stackexchange.com/questions/186164/penetration-testing-of-iaas-paas-environment-cvss-score
45,Do I need to trust my Paas provider?,"
I am currently entering the world of deploying my web application to the cloud.
While trying out Paas providers like heroku, I realized, that the platform has full access to my application. The docker container I'm deploying via there command line tool is fully readable by heroku and passwords for database, external storage providers are all in my env variables that are also stored in my heroku account.
Does this mean, I need to fully trust my paas provider?
In my mind a simple VPS would be safer in that regard, because the iaas provider does not need (have?) access to my private machine. Only I have the password to that server. And my application code and passwords are inside the machine, so he has no access to it.
Of course the server would probably be more insecure to the outside world than my nodes on paas, because I have to configure the application hosting myself with a VPS and I'm certainly not as qualified as people who get paid for that stuff.
Is there some truth in this text or am I understanding something wrong here?
",100,0,1,32 times,2018-04-28 11:53:42Z,/questions/184792/do-i-need-to-trust-my-paas-provider,https://security.stackexchange.com/questions/184792/do-i-need-to-trust-my-paas-provider
46,What are the privacy conerns with cloud based submission in antivirus?,"
It seems like many antivirus programs use the cloud to scan files for malware. Isn't this a privacy concern if local files are being uploaded to the cloud? For example with Automatic Sample Submission and Cloud Based Protection in Windows 10.
How exactly does this work because if some remote computer in the cloud can detect it, why not just have virus signature updates (like the old way of doing it)? If they use more advanced scanning techniques wouldn't this imply the whole file is being transferred and run? 
",104,5,3,170 times,2018-04-12 14:17:28Z,/questions/183553/what-are-the-privacy-conerns-with-cloud-based-submission-in-antivirus,https://security.stackexchange.com/questions/183553/what-are-the-privacy-conerns-with-cloud-based-submission-in-antivirus
47,Detect and Scan Open Ports,"
I am trying to understand two questions -

I run Qualys/Nessus scans on periodic basis in our Azure/AWS environment and always run into issues while detecting for Open ports, A basic nmap scan would detect open port however a Qualys/Nessus scan doesn't seem to detect. How can i make sure i get the best results when I run the scans everytime using these scanners? If I have to run NMAP on Public IP's in our AZURE environment, what would be the best practice to run these scans ?
how can I run scans on Cloud environment like Azure/AWS to detect for open ports on continuous basis? 

",106,0,1,346 times,2018-04-05 01:15:52Z,/questions/182951/detect-and-scan-open-ports,https://security.stackexchange.com/questions/182951/detect-and-scan-open-ports
48,How can I protect my cloud processing from everyone … even those with root access?,"
How can I run my top secret code and data on any cloud hosting provider such that everyone even the hosting vendor with root is denied access ? ... a research proposal
What is the current state of either userspace or  OS architecture such that only processes running with a one time expiring key can gain access to OS managed resources ( memory/networking/CPU)? It is not that data structures managed by the OS are all encrypted, rather that they appear encrypted to non key holders. Users running under root also must have such a key.  Basically remove the notion of root with its unlimited powers. How far along is any project gotten so far towards providing this goal?
It does not go unnoticed that to solve the issue of an underlying hypervisor like OS having access to my computation I could scatter my code and data across multiple cloud providers and reconstitute downstream on my own local client such that no single cloud OS can gain any semantics 
Perhaps userspace application level is better suited than the OS to implement this scatter then gather distributed encrypted chunking of compute and data
... the analogy would be a biological organism who's cells function in tiny disperse bodies where the entire organism only coalesces after the state of each cell is reported back to my secure client running locally ...  sure this is computationally inefficient however I am willing to pay this price for ultimate privacy ... any security less than this is a joke since I cannot prove that the powers to be in today's cloud compute environments do not have their fingers in the pie
",108,-1,1,145 times,2018-03-29 19:14:37Z,/questions/182150/how-can-i-protect-my-cloud-processing-from-everyone-even-those-with-root-acc,https://security.stackexchange.com/questions/182150/how-can-i-protect-my-cloud-processing-from-everyone-even-those-with-root-acc
